{
  "$schema": "https://json-schema.org/draft/2020-12/schema",
  "$id": "https://writing-blocks/essay/schema/essay-type.schema.json",
  "title": "Essay Type",
  "description": "A named essay form as an ordered composition of components, plus any organizational patterns unique to choosing between arrangements of that form.",
  "type": "object",
  "required": ["id", "name", "purpose", "components"],
  "additionalProperties": false,
  "properties": {
    "id": {
      "type": "string",
      "pattern": "^[a-z][a-z0-9]*(-[a-z0-9]+)*$"
    },
    "name": { "type": "string" },
    "purpose": {
      "type": "string",
      "description": "What this essay type is for, crux-first — the reader need it answers, not a definition of its shape."
    },
    "subtype_of": {
      "type": "string",
      "description": "id of a broader essay type this specializes (e.g. compare-contrast is a subtype of expository)."
    },
    "components": {
      "type": "array",
      "description": "Ordered top-to-bottom as they'd appear in the essay.",
      "items": {
        "type": "object",
        "required": ["ref", "required"],
        "additionalProperties": false,
        "properties": {
          "ref": { "type": "string", "description": "A component id from components.json." },
          "required": { "type": "boolean" },
          "note": {
            "type": "string",
            "description": "How this component's job narrows for this specific essay type, if it does."
          }
        }
      }
    },
    "organizational_patterns": {
      "type": "array",
      "description": "Named alternative arrangements a writer chooses between for this type (e.g. block vs. point-by-point). Omit if the type has only one natural order.",
      "items": {
        "type": "object",
        "required": ["id", "name", "description"],
        "additionalProperties": false,
        "properties": {
          "id": { "type": "string" },
          "name": { "type": "string" },
          "description": { "type": "string" }
        }
      }
    },
    "pitfalls": {
      "type": "array",
      "description": "Failure modes specific to this type, worth checking for directly.",
      "items": { "type": "string" }
    }
  }
}
