{
  "id": "cause-effect",
  "name": "Cause and Effect Essay",
  "purpose": "Explains why something happened, or what resulted from it, by demonstrating the causal mechanism rather than asserting a link.",
  "subtype_of": "expository",
  "components": [
    { "ref": "thesis-statement", "required": true, "note": "States the causal claim being made — which cause(s), which effect(s)." },
    { "ref": "causal-link", "required": true },
    { "ref": "transition", "required": true },
    { "ref": "conclusion", "required": true }
  ],
  "organizational_patterns": [
    { "id": "single-cause-multiple-effects", "name": "Single Cause, Multiple Effects", "description": "One cause is shown producing several distinct effects." },
    { "id": "multiple-causes-single-effect", "name": "Multiple Causes, Single Effect", "description": "Several independent causes are shown converging on one effect." },
    { "id": "causal-chain", "name": "Causal Chain", "description": "A leads to B leads to C — each link is a cause of the next." }
  ],
  "pitfalls": [
    "Correlation presented as causation with no mechanism shown.",
    "A single-cause narrative for a phenomenon that's actually multi-causal.",
    "A causal chain with a missing link the reader has to infer."
  ]
}
