{
  "id": "literary-analysis",
  "name": "Literary Analysis Essay",
  "purpose": "Argues for an interpretation of a text, grounded in the text's own words rather than a summary of what happens in it.",
  "components": [
    { "ref": "thesis-statement", "required": true, "note": "An interpretive claim about the text, not a summary of its plot." },
    { "ref": "topic-sentence", "required": true },
    { "ref": "textual-evidence", "required": true },
    { "ref": "close-reading", "required": true, "note": "The step most drafts skip — a quote dropped in with no explanation of how it supports the claim." },
    { "ref": "conclusion", "required": true, "note": "States the significance of the interpretation, not a recap of the text." }
  ],
  "pitfalls": [
    "Evidence dropped in with no close reading — a quote followed immediately by the next point.",
    "A thesis that's actually plot summary rather than an interpretive claim.",
    "Close reading that restates the quote in different words instead of explaining what it implies."
  ]
}
