{
  "id": "expository",
  "name": "Expository Essay",
  "purpose": "Explains or informs on a topic using facts and examples while staying neutral — the writer's opinion isn't the point.",
  "components": [
    { "ref": "hook", "required": false },
    { "ref": "thesis-statement", "required": true, "note": "States a topic or fact, not an opinion — the line that distinguishes this from persuasive writing." },
    { "ref": "topic-sentence", "required": true },
    { "ref": "evidence", "required": true, "note": "Facts, examples, or data — not the writer's opinion." },
    { "ref": "transition", "required": false },
    { "ref": "conclusion", "required": true, "note": "Synthesizes what the evidence adds up to, rather than repeating the thesis." }
  ],
  "organizational_patterns": [
    { "id": "chronological", "name": "Chronological", "description": "Orders the explanation by time or sequence." },
    { "id": "classification", "name": "Classification", "description": "Sorts the topic into categories and explains each in turn." },
    { "id": "compare-contrast", "name": "Compare/Contrast", "description": "See the compare-contrast essay type — a named subtype of expository." },
    { "id": "cause-effect", "name": "Cause and Effect", "description": "See the cause-effect essay type — a named subtype of expository." },
    { "id": "process", "name": "Process", "description": "See the process essay type — a named subtype of expository." }
  ],
  "pitfalls": [
    "The thesis smuggles in an opinion, drifting into persuasive writing without arguing for the position.",
    "Body paragraphs restate the thesis instead of adding new evidence.",
    "Evidence presented with no topic sentence, so the reader can't tell what point it's proving."
  ]
}
